{"created_at_ms":1754676000000,"edition":{"edition_id":"edition-guide-audio-v1","support_languages":[],"target_language":"en","title":"Museum Guided Tour"},"entrypoints":[{"entrypoint_id":"primary","resource_id":"sha256:ec61b87a2afaddcccf97229a1b1e7b940e74b98ce6a5be21ca53be262c1036dc"}],"extensions":{},"material":{"material_id":"material-guide-audio-v1","material_revision_id":"revision-guide-audio-v1","title":"Museum Guided Tour"},"renditions":[{"descriptor":{"extensions":{},"kind":"audio","material_revision_id":"revision-guide-audio-v1","media_blob":{"digest":"sha256:db868bc797d3b618d49c1855c1d893186288a4c0586e3dedfe1a3ce230fbd390","size_bytes":3291402},"media_type":"audio/mpeg","schema":"listen.rendition.audio.v1"},"rendition_id":"sha256:cb9d277133f3c9008050f040ed9a2028b5694c51ce429fb87c44bade7d52643e"}],"resources":[{"descriptor":{"content_language":"en","dependencies":[],"extensions":{},"kind":"timed_text_track","payload_blob":{"digest":"sha256:29ecf0e48149f3706ded9e9ea048df6635f977b55e20ecb29365e810cf58fbb9","size_bytes":444},"provenance":{"created_at_ms":1754676000000,"extensions":{},"input_resource_ids":[],"tool":{"id":"listen-gen","version":"0.4.0"}},"quality":{"extensions":{},"review_status":"human_reviewed","warnings":[]},"role":"base","schema":"listen.payload.timed-text-track.v2","subject":{"anchor_resource_ids":[],"material_revision_id":"revision-guide-audio-v1","rendition_ids":[]}},"required":true,"resource_id":"sha256:ec61b87a2afaddcccf97229a1b1e7b940e74b98ce6a5be21ca53be262c1036dc"}],"schema":"listen.content-package.release.v2"}