{"created_at_ms":1754676000000,"edition":{"edition_id":"edition-panda-hybrid-v1","support_languages":["zh-Hans"],"target_language":"en","title":"Pandas (Bilingual)"},"entrypoints":[{"entrypoint_id":"primary","resource_id":"sha256:8e5f5bab9583a4464910e2ce6b1b15fbc4b3d2a54688cfa8e7dc8f5ba9ed6af5"}],"extensions":{},"material":{"material_id":"material-panda-hybrid-v1","material_revision_id":"revision-panda-hybrid-v1","title":"All About Pandas"},"renditions":[],"resources":[{"descriptor":{"content_language":"en","dependencies":[],"extensions":{},"kind":"document_text","payload_blob":{"digest":"sha256:1bee26b045e7c90d616405bb6d173a2db22b6d3f2851d02242e5adccda41cbff","size_bytes":423},"provenance":{"created_at_ms":1754676000000,"extensions":{},"input_resource_ids":[],"tool":{"id":"listen-gen","version":"0.4.0"}},"quality":{"extensions":{},"review_status":"human_reviewed","warnings":[]},"role":"base","schema":"listen.payload.document-text.v1","subject":{"anchor_resource_ids":[],"material_revision_id":"revision-panda-hybrid-v1","rendition_ids":[]}},"required":true,"resource_id":"sha256:8e5f5bab9583a4464910e2ce6b1b15fbc4b3d2a54688cfa8e7dc8f5ba9ed6af5"},{"descriptor":{"dependencies":[{"resource_id":"sha256:8e5f5bab9583a4464910e2ce6b1b15fbc4b3d2a54688cfa8e7dc8f5ba9ed6af5"}],"extensions":{},"kind":"translation","payload_blob":{"digest":"sha256:a9c749023a1e0b8273c13317c591f974e4df6c9c2fc861865840e138e13d7b28","size_bytes":480},"provenance":{"created_at_ms":1754676000000,"extensions":{},"input_resource_ids":["sha256:8e5f5bab9583a4464910e2ce6b1b15fbc4b3d2a54688cfa8e7dc8f5ba9ed6af5"],"model":{"id":"listen-mt","version":"1.0.0"},"tool":{"id":"listen-gen","version":"0.4.0"}},"quality":{"extensions":{},"review_status":"machine_checked","warnings":[]},"role":"assistance","schema":"listen.payload.translation.v1","subject":{"anchor_resource_ids":[],"material_revision_id":"revision-panda-hybrid-v1","rendition_ids":[]},"support_languages":["zh-Hans"]},"required":false,"resource_id":"sha256:2931332291c5cda926f864246496ae740849aae1b37b9c88f916c974d9999e15"},{"descriptor":{"content_language":"en","dependencies":[],"extensions":{},"kind":"word_timeline","payload_blob":{"digest":"sha256:c8ff7cde6f7617c7cb9bf18aec92845fce519ab74018887c7fc9ab8ab5033145","size_bytes":8124},"provenance":{"created_at_ms":1754676000000,"extensions":{},"input_resource_ids":[],"tool":{"id":"listen-gen","version":"0.4.0"}},"quality":{"extensions":{},"review_status":"unreviewed","warnings":["word timeline enrichment is not yet produced"]},"role":"base","schema":"listen.payload.word-timeline.v1","subject":{"anchor_resource_ids":[],"material_revision_id":"revision-panda-hybrid-v1","rendition_ids":[]}},"required":false,"resource_id":"sha256:a8f98881a671bb2019656ca032cfbc2d4c3d32205b654d49185aa1b0e2530e6d"}],"schema":"listen.content-package.release.v2"}