{"created_at_ms":1754676000000,"edition":{"edition_id":"edition-coffee-text-v1","support_languages":[],"target_language":"en","title":"A Short History of Coffee (Text)"},"entrypoints":[{"entrypoint_id":"primary","resource_id":"sha256:44b2f5434663c269a7afebb782e4c60e51eeec29ae5c6ef793bd69b3eeab4a22"}],"extensions":{},"material":{"material_id":"material-coffee-text-v1","material_revision_id":"revision-coffee-text-v1","title":"A Short History of Coffee"},"renditions":[],"resources":[{"descriptor":{"content_language":"en","dependencies":[],"extensions":{},"kind":"document_text","payload_blob":{"digest":"sha256:49128790cdb73915d8eef1a4c0cc9bb953c2d875e2e366bac8fd2276920f7c6f","size_bytes":438},"provenance":{"created_at_ms":1754676000000,"extensions":{},"input_resource_ids":[],"tool":{"id":"listen-gen","version":"0.4.0"}},"quality":{"extensions":{},"review_status":"human_reviewed","warnings":[]},"role":"base","schema":"listen.payload.document-text.v1","subject":{"anchor_resource_ids":[],"material_revision_id":"revision-coffee-text-v1","rendition_ids":[]}},"required":true,"resource_id":"sha256:44b2f5434663c269a7afebb782e4c60e51eeec29ae5c6ef793bd69b3eeab4a22"}],"schema":"listen.content-package.release.v2"}